{"apiVersion":"modos.pleiades/v1alpha1","approvals":[{"algorithm":"Ed25519","approvalId":"approval:synthetic-steward:v1","conflictDeclared":false,"firstPassIndependent":true,"keyRef":"key:synthetic-steward-v1","nonce":"aaaaaaaaaaaaaaaaaaaaaaaaaaaaaaaaaaaaaaaaaaaaaaaaaaaaaaaaaaaaaaaa","position":"approve","principalRef":"human:synthetic-steward","recused":false,"signatureBase64":"E9ibS6VipdqpAUt0HBLO7RRZPGzMaIOzZmk9y0pkyt/UPWhS9i2q6SfhWz8TSWiJavyy3Zu1PfJiu9sPQ1wGAg==","signedAt":"2026-07-20T23:25:00Z"},{"algorithm":"Ed25519","approvalId":"approval:synthetic-mind:v1","conflictDeclared":false,"firstPassIndependent":true,"keyRef":"key:synthetic-mind-v1","nonce":"bbbbbbbbbbbbbbbbbbbbbbbbbbbbbbbbbbbbbbbbbbbbbbbbbbbbbbbbbbbbbbbb","position":"approve","principalRef":"mind:pleiades","recused":false,"signatureBase64":"hixn9QmSoTmbgXPUFhknIrCobuHe2gtBrSh1ji4QdKkhdG31GWNeZ6zn9pOul0VOuhu29Udp5xHuFLDLWFTzCw==","signedAt":"2026-07-20T23:26:00Z"},{"algorithm":"Ed25519","approvalId":"approval:synthetic-auditor:v1","conflictDeclared":false,"firstPassIndependent":true,"keyRef":"key:synthetic-auditor-v1","nonce":"cccccccccccccccccccccccccccccccccccccccccccccccccccccccccccccccc","position":"audit","principalRef":"service:synthetic-auditor","recused":false,"signatureBase64":"MURr+669K5mV0bGLRzMxGRNYfCae2USXsTXTa1VBJwH3BSsgbBekBFHz194dI1mbUIOvkI8AjFKJjK7tWp2cDw==","signedAt":"2026-07-20T23:27:00Z"}],"authority":{"authorizationApplied":false,"ceiling":"none","executionApplied":false,"mandateConstructed":false,"preflightOnly":true},"authorizationId":"transition-authorization:synthetic-canary-v1","candidateDigest":"sha256:63f923727ca0ab01a2ab4b07232c45e94097d5b3628bedd69d1914e5f31889f3","compilationReceiptDigest":"sha256:7381dc6432319c009d7fbd33ebd2ff56f28daee6a14518cd08561bdb9168ca9e","decision":{"action":"authorize-admission","authorizationMode":"mixed-quorum","decisionType":"canary-admission","domain":"ontology","riskTier":"bounded-persistent"},"evidenceTrustReceiptDigest":"sha256:be064effd41274e9cb24987c1793ca0c559ac74d244103f16914740db0c59b48","executorCapability":"ontology.admission.apply","executorRef":"service:synthetic-executor","grantDigest":"sha256:2c72505ecf2ecba995c7f56bd7068f9b221483d4442abf486a7dee926007ffdd","grantRef":"grant:mind-pleiades:ontology-bounded-v1","kind":"TransitionAuthorizationCandidate","lineage":{"predecessorDigest":"sha256:cccccccccccccccccccccccccccccccccccccccccccccccccccccccccccccccc","rollbackDigest":"sha256:cccccccccccccccccccccccccccccccccccccccccccccccccccccccccccccccc","targetDigest":"sha256:dddddddddddddddddddddddddddddddddddddddddddddddddddddddddddddddd"},"plan":{"outputId":"canary-admission-plan","planDigest":"sha256:ec2ac24c6484160e88d1f8eaa60f7c079ade398007c02b432f3e5d290f3dc4da"},"proposerRef":"service:synthetic-proposer"}
